cve_id,vendor_project,product,vulnerability_name,date_added,short_description,required_action,due_date,notes,grp,pub_date,cvss,cwe,vector,complexity,severity
CVE-2021-27104,accellion,FTA,Accellion FTA OS Command Injection Vulnerability,2021-11-03,Accellion FTA 9_12_370 and earlier is affected by OS command execution via a crafted POST request to various admin endpoints.,Apply updates per vendor instructions.,2021-11-17,,1,2021-02-16,9.8,CWE-78,NETWORK,LOW,CRITICAL
CVE-2021-27102,accellion,FTA,Accellion FTA OS Command Injection Vulnerability,2021-11-03,Accellion FTA 9_12_411 and earlier is affected by OS command execution via a local web service call.,Apply updates per vendor instructions.,2021-11-17,,1,2021-02-16,7.8,CWE-78,LOCAL,LOW,HIGH
CVE-2021-27101,accellion,FTA,Accellion FTA SQL Injection Vulnerability,2021-11-03,Accellion FTA 9_12_370 and earlier is affected by SQL injection via a crafted Host header in a request to document_root.html.,Apply updates per vendor instructions.,2021-11-17,,1,2021-02-16,9.8,CWE-89,NETWORK,LOW,CRITICAL
CVE-2021-27103,accellion,FTA,Accellion FTA SSRF Vulnerability,2021-11-03,Accellion FTA 9_12_411 and earlier is affected by SSRF via a crafted POST request to wmProgressstat.html.,Apply updates per vendor instructions.,2021-11-17,,1,2021-02-16,9.8,CWE-918,NETWORK,LOW,CRITICAL
CVE-2021-21017,adobe,Acrobat and Reader,Adobe Acrobat and Reader Heap-based Buffer Overflow Vulnerability,2021-11-03,"Acrobat Reader DC versions versions 2020.013.20074 (and earlier), 2020.001.30018 (and earlier) and 2017.011.30188 (and earlier) are affected by a heap-based buffer overflow vulnerability. An unauthenticated attacker could leverage this vulnerability to achieve arbitrary code execution in the context of the current user. Exploitation of this issue requires user interaction in that a victim must open a malicious file.",Apply updates per vendor instructions.,2021-11-17,,1,2021-02-11,8.8,CWE-787,NETWORK,LOW,HIGH
CVE-2021-28550,adobe,Acrobat and Reader,Adobe Acrobat and Reader Use-After-Free Vulnerability,2021-11-03,"Acrobat Reader DC versions versions 2021.001.20150 (and earlier), 2020.001.30020 (and earlier) and 2017.011.30194 (and earlier) are affected by a Use After Free vulnerability. An unauthenticated attacker could leverage this vulnerability to achieve arbitrary code execution in the context of the current user. Exploitation of this issue requires user interaction in that a victim must open a malicious file.",Apply updates per vendor instructions.,2021-11-17,,1,2021-09-02,8.8,CWE-416,NETWORK,LOW,HIGH
CVE-2018-4939,adobe,ColdFusion,Adobe ColdFusion Deserialization of Untrusted Data vulnerability,2021-11-03,"Adobe ColdFusion Update 5 and earlier versions, ColdFusion 11 Update 13 and earlier versions have an exploitable Deserialization of Untrusted Data vulnerability. Successful exploitation could lead to arbitrary code execution.",Apply updates per vendor instructions.,2022-05-03,,1,2018-05-19,9.8,CWE-502,NETWORK,LOW,CRITICAL
CVE-2018-15961,adobe,ColdFusion,Adobe ColdFusion Remote Code Execution,2021-11-03,"Adobe ColdFusion versions July 12 release (2018.0.0.310739), Update 6 and earlier, and Update 14 and earlier have an unrestricted file upload vulnerability. Successful exploitation could lead to arbitrary code execution.",Apply updates per vendor instructions.,2022-05-03,,1,2018-09-25,9.8,CWE-434,NETWORK,LOW,CRITICAL
CVE-2018-4878,adobe,Flash Player,Adobe Flash Player Use-After-Free Vulnerability,2021-11-03,A use-after-free vulnerability was discovered in Adobe Flash Player before 28.0.0.161. This vulnerability occurs due to a dangling pointer in the Primetime SDK related to media player handling of listener objects. A successful attack can lead to arbitrary code execution. This was exploited in the wild in January and February 2018.,The impacted product is end-of-life and should be disconnected if still in use.,2022-05-03,,1,2018-02-06,9.8,CWE-416,NETWORK,LOW,CRITICAL
CVE-2020-5735,amcrest,Cameras and Network Video Recorder (NVR),Amcrest Camera and NVR Buffer Overflow Vulnerability,2021-11-03,Amcrest cameras and NVR are vulnerable to a stack-based buffer overflow over port 37777. An authenticated remote attacker can abuse this issue to crash the device and possibly execute arbitrary code.,Apply updates per vendor instructions.,2022-05-03,,1,2020-04-08,8.8,CWE-787,NETWORK,LOW,HIGH
CVE-2019-2215,android,Android OS,"Android ""AbstractEmu"" Root Access Vulnerabilities",2021-11-03,,Apply updates per vendor instructions.,2022-05-03,,1,2019-10-11,7.8,CWE-416,LOCAL,LOW,HIGH
CVE-2020-0041,android,Android OS,"Android ""AbstractEmu"" Root Access Vulnerabilities",2021-11-03,,Apply updates per vendor instructions.,2022-05-03,,1,2020-03-10,7.8,CWE-787,LOCAL,LOW,HIGH
CVE-2020-0069,android,Android OS,"Android ""AbstractEmu"" Root Access Vulnerabilities",2021-11-03,,Apply updates per vendor instructions.,2022-05-03,,1,2020-03-10,7.8,CWE-787,LOCAL,LOW,HIGH
CVE-2017-9805,apache,Struts,Apache Struts Multiple Versions Remote Code Execution Vulnerability,2021-11-03,The REST Plugin in Apache Struts 2.1.1 through 2.3.x before 2.3.34 and 2.5.x before 2.5.13 contains a vulnerability which can lead to Remote Code Execution.,Apply updates per vendor instructions.,2022-05-03,,1,2017-09-15,8.1,CWE-502,NETWORK,HIGH,HIGH
CVE-2021-42013,apache,HTTP Server,Apache HTTP Server 2.4.49 and 2.4.50 Path Traversal,2021-11-03,Apache HTTP server vulnerabilities allow an attacker to use a path traversal attack to map URLs to files outside the expected document root and perform Remote Code Execution.,Apply updates per vendor instructions.,2021-11-17,,1,2021-10-07,9.8,CWE-22,NETWORK,LOW,CRITICAL
CVE-2021-41773,apache,HTTP Server,Apache HTTP Server Path Traversal Vulnerability,2021-11-03,"A flaw was found in a change made to path normalization in Apache HTTP Server 2.4.49. An attacker could use a path traversal attack to map URLs to files outside the directories configured by Alias-like directives. If files outside of these directories are not protected by the usual default configuration ""require all denied"", these requests can succeed. If CGI scripts are also enabled for these aliased pathes, this could allow for remote code execution. This issue is known to be exploited in the wild. This issue only affects Apache 2.4.49 and not earlier versions. The fix in Apache HTTP Server 2.4.50 was found to be incomplete, see CVE-2021-42013.",Apply updates per vendor instructions.,2021-11-17,,1,2021-10-05,7.5,CWE-22,NETWORK,LOW,HIGH
CVE-2019-0211,apache,HTTP Server,Apache HTTP Server scoreboard vulnerability,2021-11-03,"In Apache HTTP Server 2.4 releases 2.4.17 to 2.4.38, with MPM event, worker or prefork, code executing in less-privileged child processes or threads (including scripts executed by an in-process scripting interpreter) could execute arbitrary code with the privileges of the parent process (usually root) by manipulating the scoreboard. Non-Unix systems are not affected.",Apply updates per vendor instructions.,2022-05-03,,1,2019-04-08,7.8,CWE-416,LOCAL,LOW,HIGH
CVE-2016-4437,apache,Shiro,Apache Shiro 1.2.4 Cookie RememberME Deserial Remote Code Execution Vulnerability,2021-11-03,"Apache Shiro before 1.2.5, when a cipher key has not been configured for the ""remember me"" feature, allows remote attackers to execute arbitrary code or bypass intended access restrictions via an unspecified request parameter.",Apply updates per vendor instructions.,2022-05-03,,1,2016-06-07,8.1,CWE-284,NETWORK,HIGH,HIGH
CVE-2019-17558,apache,Solr,Apache Solr 5.0.0-8.3.1 Remote Code Execution Vulnerability,2021-11-03,"Apache Solr 5.0.0 to Apache Solr 8.3.1 are vulnerable to a Remote Code Execution through the VelocityResponseWriter. A Velocity template can be provided through Velocity templates in a configset `velocity/` directory or as a parameter. A user defined configset could contain renderable, potentially malicious, templates. Parameter provided templates are disabled by default, but can be enabled by setting `params.resource.loader.enabled` by defining a response writer with that setting set to `true`. Defining a response writer requires configuration API access. Solr 8.4 removed the params resource loader entirely, and only enables the configset-provided template rendering when the configset is `trusted` (has been uploaded by an authenticated user).",Apply updates per vendor instructions.,2022-05-03,,1,2019-12-30,7.5,CWE-74,NETWORK,HIGH,HIGH
CVE-2020-17530,apache,Struts,Apache Struts Forced OGNL Double Evaluation Remote Code Execution,2021-11-03,"Forced OGNL evaluation, when evaluated on raw user input in tag attributes, may lead to remote code execution. Affected software : Apache Struts 2.0.0 - Struts 2.5.25.",Apply updates per vendor instructions.,2022-05-03,,1,2020-12-11,9.8,CWE-917,NETWORK,LOW,CRITICAL
CVE-2017-5638,apache,Struts,Apache Struts Jakarta Multipart parser exception handling vulnerability,2021-11-03,"The Jakarta Multipart parser in Apache Struts 2 2.3.x before 2.3.32 and 2.5.x before 2.5.10.1 has incorrect exception handling and error-message generation during file-upload attempts, which allows remote attackers to execute arbitrary commands via a crafted Content-Type, Content-Disposition, or Content-Length HTTP header, as exploited in the wild in March 2017 with a Content-Type header containing a #cmd= string.",Apply updates per vendor instructions.,2022-05-03,,1,2017-03-11,10,CWE-20,NETWORK,LOW,CRITICAL
CVE-2018-11776,apache,Struts,Apache Struts 2.3 to 2.3.34 and 2.5 to 2.5.16 Remote Code Execution Vulnerability,2021-11-03,Apache Struts versions 2.3 to 2.3.34 and 2.5 to 2.5.16 contain a vulnerability which can allow for remote code execution.,Apply updates per vendor instructions.,2022-05-03,,1,2018-08-22,8.1,CWE-20,NETWORK,HIGH,HIGH
CVE-2021-30858,apple,iOS and iPadOS,Apple Apple iOS and iPadOS Use-After-Free Vulnerability,2021-11-03,Apple iOS and iPadOS Arbitrary Code Execution,Apply updates per vendor instructions.,2021-11-17,,1,2021-08-24,8.8,CWE-416,NETWORK,LOW,HIGH
CVE-2019-6223,apple,FaceTime,Apple FaceTime Vulnerability,2021-11-03,"A logic issue existed in the handling of Group FaceTime calls. The issue was addressed with improved state management. This issue is fixed in iOS 12.1.4, macOS Mojave 10.14.3 Supplemental Update. The initiator of a Group FaceTime call may be able to cause the recipient to answer.",Apply updates per vendor instructions.,2022-05-03,,1,2019-03-05,7.5,NVD-CWE-noinfo,NETWORK,LOW,HIGH
CVE-2021-30860,apple,iOS,"Apple iOS ""FORCEDENTRY"" Remote Code Execution Vulnerability",2021-11-03,An integer overflow was addressed with improved input validation vulnerability affecting iOS devices that allows for remote code execution.,Apply updates per vendor instructions.,2021-11-17,,1,2021-08-24,7.8,CWE-190,LOCAL,LOW,HIGH
CVE-2020-27930,apple,iOS and macOS,Apple iOS and macOS FontParser Remote Code Execution Vulnerability,2021-11-03,A memory corruption issue was addressed with improved input validation. Processing a maliciously crafted font may lead to arbitrary code execution.,Apply updates per vendor instructions.,2022-05-03,,1,2020-12-08,7.8,CWE-787,LOCAL,LOW,HIGH
CVE-2021-30807,apple,iOS and macOS,Apple iOS and macOS Memory Corruption Vulnerability,2021-11-03,,Apply updates per vendor instructions.,2021-11-17,,1,2021-10-19,7.8,NVD-CWE-noinfo,LOCAL,LOW,HIGH
CVE-2020-27950,apple,iOS and macOS,Apple iOS and macOS Kernel Memory Initialization Vulnerability,2021-11-03,A malicious application may be able to disclose kernel memory.,Apply updates per vendor instructions.,2022-05-03,,1,2020-12-08,5.5,CWE-665,LOCAL,LOW,MEDIUM
CVE-2020-27932,apple,iOS and macOS,Apple iOS and macOS Kernel Type Confusion Vulnerability,2021-11-03,A malicious application may be able to execute arbitrary code with kernel privileges.,Apply updates per vendor instructions.,2022-05-03,,1,2020-12-08,7.8,CWE-843,LOCAL,LOW,HIGH
CVE-2020-9818,apple,iOS Mail,Apple iOS Mail OOB Vulnerability,2021-11-03,Processing a maliciously crafted mail message may lead to unexpected memory modification or application termination.,Apply updates per vendor instructions.,2022-05-03,,1,2020-06-09,8.8,CWE-787,NETWORK,LOW,HIGH
CVE-2020-9819,apple,iOS Mail,Apple iOS Mail Heap Overflow Vulnerability,2021-11-03,Processing a maliciously crafted mail message may lead to heap corruption.,Apply updates per vendor instructions.,2022-05-03,,1,2020-06-09,4.3,CWE-787,NETWORK,LOW,MEDIUM
CVE-2021-30762,apple,iOS,Apple WebKit Browser Engine Use-After-Free Vulnerability,2021-11-03,Use after free issue. Processing maliciously crafted web content may lead to arbitrary code execution. Apple is aware of a report that this issue may have been actively exploited.,Apply updates per vendor instructions.,2021-11-17,,1,2021-09-08,8.8,CWE-416,NETWORK,LOW,HIGH
CVE-2021-1782,apple,iOS,Apple iOS Privilege Escalation and Code Execution Chain,2021-11-03,A malicious application may be able to elevate privileges. Apple is aware of a report that this issue may have been actively exploited.,Apply updates per vendor instructions.,2021-11-17,,1,2021-04-02,7,"CWE-362,CWE-269",LOCAL,HIGH,HIGH
CVE-2021-1870,apple,iOS,Apple iOS Privilege Escalation and Code Execution Chain,2021-11-03,A remote attacker may be able to cause arbitrary code execution. Apple is aware of a report that this issue may have been actively exploited.,Apply updates per vendor instructions.,2021-11-17,,1,2021-04-02,9.8,NVD-CWE-noinfo,NETWORK,LOW,CRITICAL
CVE-2021-1871,apple,iOS,Apple iOS Privilege Escalation and Code Execution Chain,2021-11-03,A remote attacker may be able to cause arbitrary code execution. Apple is aware of a report that this issue may have been actively exploited.,Apply updates per vendor instructions.,2021-11-17,,1,2021-04-02,9.8,NVD-CWE-noinfo,NETWORK,LOW,CRITICAL
CVE-2021-1879,apple,iOS,Apple iOS Webkit Browser Engine XSS,2021-11-03,Processing maliciously crafted web content may lead to universal cross site scripting. Apple is aware of a report that this issue may have been actively exploited.,Apply updates per vendor instructions.,2021-11-17,,1,2021-04-02,6.1,CWE-79,NETWORK,LOW,MEDIUM
CVE-2021-30661,apple,iOS,Apple iOS Webkit Storage Use-After-Free Remote Code Execution Vulnerability,2021-11-03,Processing maliciously crafted web content may lead to arbitrary code execution. Apple is aware of a report that this issue may have been actively exploited.,Apply updates per vendor instructions.,2021-11-17,,1,2021-09-08,8.8,CWE-416,NETWORK,LOW,HIGH
CVE-2021-30666,apple,iOS,Apple iOS12.x Buffer Overflow,2021-11-03,Processing maliciously crafted web content may lead to arbitrary code execution. Apple is aware of a report that this issue may have been actively exploited.,Apply updates per vendor instructions.,2021-11-17,,1,2021-09-08,8.8,CWE-120,NETWORK,LOW,HIGH
CVE-2021-30713,apple,macOS,Apple macOS Input Validation Error,2021-11-03,A malicious application may be able to bypass Privacy preferences. Apple is aware of a report that this issue may have been actively exploited.,Apply updates per vendor instructions.,2021-11-17,,1,2021-09-08,7.8,CWE-863,LOCAL,LOW,HIGH
CVE-2021-30657,apple,macOS,Apple macOS Policy Subsystem Gatekeeper Bypass,2021-11-03,A malicious application may bypass Gatekeeper checks. Apple is aware of a report that this issue may have been actively exploited.,Apply updates per vendor instructions.,2021-11-17,,1,2021-09-08,5.5,CWE-494,LOCAL,LOW,MEDIUM
CVE-2021-30665,apple,Safari,Apple Safari Webkit Browser Engine Buffer Overflow Vulnerability,2021-11-03,Processing maliciously crafted web content may lead to arbitrary code execution. Apple is aware of a report that this issue may have been actively exploited.,Apply updates per vendor instructions.,2021-11-17,,1,2021-09-08,8.8,CWE-787,NETWORK,LOW,HIGH
CVE-2021-30663,apple,Safari,Apple Safari Webkit Browser Engine Integer Overflow Vulnerability,2021-11-03,Integer overflow. Processing maliciously crafted web content may lead to arbitrary code execution.,Apply updates per vendor instructions.,2021-11-17,,1,2021-09-08,8.8,CWE-190,NETWORK,LOW,HIGH
CVE-2021-30761,apple,iOS,Apple WebKit Browser Engine Memory Corruption Vulnerability,2021-11-03,Memory corruption issue. Processing maliciously crafted web content may lead to arbitrary code execution. Apple is aware of a report that this issue may have been actively exploited.,Apply updates per vendor instructions.,2021-11-17,,1,2021-09-08,8.8,CWE-787,NETWORK,LOW,HIGH
CVE-2021-30869,apple,"iOS, macOS, and iPadOS",Apple XNU Kernel Type Confusion,2021-11-03,Apple XNU kernel contains a type confusion vulnerability which allows a malicious application to execute arbitrary code with kernel privileges.,Apply updates per vendor instructions.,2021-11-17,,1,2021-08-24,7.8,CWE-843,LOCAL,LOW,HIGH
CVE-2020-9859,apple,iOS and iPadOS,Apple 11-13.5 XNU Kernel Vulnerability,2021-11-03,A memory consumption issue was addressed with improved memory handling. An application may be able to execute arbitrary code with kernel privileges.,Apply updates per vendor instructions.,2022-05-03,,1,2020-06-05,7.8,NVD-CWE-noinfo,LOCAL,LOW,HIGH
CVE-2021-20090,arcadyan,Buffalo WSR-2533DHPL2 and WSR-2533DHP3 firmware,Arcadyan Buffalo Firmware Multiple Versions Path Traversal,2021-11-03,A path traversal vulnerability in Arcadyan firmware could allow unauthenticated remote attackers to bypass authentication. It impacts many routers.,Apply updates per vendor instructions.,2021-11-17,,1,2021-04-29,9.8,CWE-22,NETWORK,LOW,CRITICAL
CVE-2021-27562,arm,Arm Trusted Firmware,Arm Trusted Firmware M through 1.2 Denial-of-Service,2021-11-03,"In Arm Trusted Firmware M through 1.2, the NS world may trigger a system halt, an overwrite of secure data, or the printing out of secure data when calling secure functions under the NSPE handler mode. This vulnerability has known active exploitation against Yealink Device Management servers. It is assessed this product utilizes the affected Arm firmware.",Apply updates per vendor instructions.,2021-11-17,,1,2021-05-25,5.5,CWE-787,LOCAL,LOW,MEDIUM
CVE-2021-28664,arm,Mali Graphics Processing Unit (GPU),Arm Mali GPU Kernel Boundary Error Vulnerability,2021-11-03,"The Arm Mali GPU kernel driver allows privilege escalation or a denial of service (memory corruption) because an unprivileged user can achieve read/write access to read-only pages. This affects Bifrost r0p0 through r28p0 before r29p0, Valhall r19p0 through r28p0 before r29p0, and Midgard r8p0 through r30p0.",Apply updates per vendor instructions.,2021-11-17,,1,2021-05-10,8.8,CWE-787,NETWORK,LOW,HIGH
CVE-2021-28663,arm,Mali Graphics Processing Unit (GPU),Arm Mali GPU Kernel Use-After-Free Vulnerability,2021-11-03,"The Arm Mali GPU kernel driver allows privilege escalation or information disclosure because GPU memory operations are mishandled, leading to a use-after-free. This affects Bifrost r0p0 through r28p0 before r29p0, Valhall r19p0 through r28p0 before r29p0, and Midgard r4p0 through r30p0.",Apply updates per vendor instructions.,2021-11-17,,1,2021-05-10,8.8,CWE-416,NETWORK,LOW,HIGH
CVE-2019-3398,atlassian,Confluence,Atlassian Confluence Path Traversal Vulnerability,2021-11-03,"Confluence Server and Data Center had a path traversal vulnerability in the downloadallattachments resource. A remote attacker who has permission to add attachments to pages and / or blogs or to create a new space or a personal space or who has 'Admin' permissions for a space can exploit this path traversal vulnerability to write files to arbitrary locations which can lead to remote code execution on systems that run a vulnerable version of Confluence Server or Data Center. All versions of Confluence Server from 2.0.0 before 6.6.13 (the fixed version for 6.6.x), from 6.7.0 before 6.12.4 (the fixed version for 6.12.x), from 6.13.0 before 6.13.4 (the fixed version for 6.13.x), from 6.14.0 before 6.14.3 (the fixed version for 6.14.x), and from 6.15.0 before 6.15.2 are affected by this vulnerability.",Apply updates per vendor instructions.,2022-05-03,,1,2019-04-18,8.8,CWE-22,NETWORK,LOW,HIGH
CVE-2021-26084,atlassian,Confluence Server,"Atlassian Confluence Server < 6.13.23, 6.14.0 - 7.12.5 Arbitrary Code Execution",2021-11-03,"Atlassian Confluence Server The affected versions are before version 6.13.23, from version 6.14.0 before 7.4.11, from version 7.5.0 before 7.11.6, and from version 7.12.0 before 7.12.5 contains an OGNL injection vulnerability which allows an attacker to execute arbitrary code.",Apply updates per vendor instructions.,2021-11-17,,1,2021-08-30,9.8,CWE-74,NETWORK,LOW,CRITICAL
CVE-2019-11580,atlassian,Crowd and Crowd Data Center,Atlassian Crowd and Crowd Data Center Remote Code Execution Vulnerability,2021-11-03,"Atlassian Crowd and Crowd Data Center had the pdkinstall development plugin incorrectly enabled in release builds. Attackers who can send unauthenticated or authenticated requests to a Crowd or Crowd Data Center instance can exploit this vulnerability to install arbitrary plugins, which permits remote code execution on systems running a vulnerable version of Crowd or Crowd Data Center. All versions of Crowd from version 2.1.0 before 3.0.5, from version 3.1.0 before 3.1.6, from version 3.2.0 before 3.2.8, from version 3.3.0 before 3.3.5, and from version 3.4.0 before 3.4.4 are affected by this vulnerability.",Apply updates per vendor instructions.,2022-05-03,,1,2019-06-03,9.8,NVD-CWE-noinfo,NETWORK,LOW,CRITICAL
CVE-2019-3396,atlassian,Atlassian Confluence Server,Remote code execution via Widget Connector macro Vulnerability,2021-11-03,Allows remote attackers to achieve path traversal and remote code execution on a Confluence Server or Data Center instance via server-side template injection.,Apply updates per vendor instructions.,2022-05-03,,1,2019-03-25,9.8,CWE-22,NETWORK,LOW,CRITICAL
CVE-2021-42258,bqe,BillQuick Web Suite,BQE BillQuick Web Suite Versions Prior to 22.0.9.1 (from 2018 through 2021) Remote Code Execution Vulnerability,2021-11-03,"BQE BillQuick Web Suite 2018 through 2021 prior to 22.0.9.1 allows SQL injection for unauthenticated remote code execution, as exploited in the wild in October 2021 for ransomware installation.",Apply updates per vendor instructions.,2021-11-17,,1,2021-10-22,9.8,CWE-89,NETWORK,LOW,CRITICAL
CVE-2020-3452,cisco,Adaptive Security Appliance (ASA) and Firepower Threat Defense (FTD),Cisco Adaptive Security Appliance and Cisco Fire Power Threat Defense directory traversal sensitive file read,2021-11-03,"A vulnerability in the web services interface of Cisco Adaptive Security Appliance (ASA) Software and Cisco Firepower Threat Defense (FTD) Software could allow an unauthenticated, remote attacker to conduct directory traversal attacks and read sensitive files on a targeted system. The vulnerability is due to a lack of proper input validation of URLs in HTTP requests processed by an affected device. An attacker could exploit this vulnerability by sending a crafted HTTP request containing directory traversal character sequences to an affected device. A successful exploit could allow the attacker to view arbitrary files within the web services file system on the targeted device. The web services file system is enabled when the affected device is configured with either WebVPN or AnyConnect features. This vulnerability cannot be used to obtain access to ASA or FTD system files or underlying operating system (OS) files.",Apply updates per vendor instructions.,2022-05-03,,1,2020-07-22,7.5,CWE-20,NETWORK,LOW,HIGH
CVE-2020-3580,cisco,Adaptive Security Appliance (ASA) and Firepower Threat Defense (FTD),Cisco ASA and FTD XSS Vulnerabilities,2021-11-03,"Multiple vulnerabilities in the web services interface of Cisco Adaptive Security Appliance (ASA) Software and Cisco Firepower Threat Defense (FTD) Software could allow an unauthenticated, remote attacker to conduct cross-site scripting (XSS) attacks against a user of the web services interface of an affected device. The vulnerabilities are due to insufficient validation of user-supplied input by the web services interface of an affected device. An attacker could exploit these vulnerabilities by persuading a user of the interface to click a crafted link. A successful exploit could allow the attacker to execute arbitrary script code in the context of the interface or allow the attacker to access sensitive, browser-based information. Note: These vulnerabilities affect only specific AnyConnect and WebVPN configurations.",Apply updates per vendor instructions.,2022-05-03,,1,2020-10-21,6.1,CWE-79,NETWORK,LOW,MEDIUM
CVE-2021-1497,cisco,HyperFlex HX,Cisco HyperFlex HX Command Injection Vulnerabilities,2021-11-03,"Multiple vulnerabilities in the web-based management interface of Cisco HyperFlex HX could allow an unauthenticated, remote attacker to perform command injection attacks against an affected device.",Apply updates per vendor instructions.,2021-11-17,,1,2021-05-06,9.8,CWE-78,NETWORK,LOW,CRITICAL
CVE-2021-1498,cisco,HyperFlex HX,Cisco HyperFlex HX Command Injection Vulnerabilities,2021-11-03,"Multiple vulnerabilities in the web-based management interface of Cisco HyperFlex HX could allow an unauthenticated, remote attacker to perform command injection attacks against an affected device.",Apply updates per vendor instructions.,2021-11-17,,1,2021-05-06,9.8,CWE-78,NETWORK,LOW,CRITICAL
