cve_id,vendor_project,product,vulnerability_name,date_added,short_description,required_action,due_date,notes,grp,pub_date,cvss,cwe,vector,complexity,severity
CVE-2020-0968,microsoft,Internet Explorer Scripting Engine,Internet Explorer Scripting Engine Memory Corruption Vulnerability,2021-11-03,A remote code execution vulnerability exists in the way that the scripting engine handles objects in memory in Internet Explorer. This CVE ID is unique from CVE-2020-0970.,Apply updates per vendor instructions.,2022-05-03,,1,2020-04-15,7.5,CWE-787,NETWORK,HIGH,HIGH
CVE-2020-1472,microsoft,Netlogon Remote Protocol (MS-NRPC),NetLogon Privilege Escalation Vulnerability,2021-11-03,"A privilege escalation vulnerability exists when an attacker establishes a vulnerable Netlogon secure channel connection to a domain controller, using the Netlogon Remote Protocol (MS-NRPC), aka 'Netlogon Elevation of Privilege Vulnerability'.",Apply updates per vendor instructions.,2020-09-21,,1,2020-08-17,10,CWE-330,NETWORK,LOW,CRITICAL
CVE-2021-26855,microsoft,Microsoft Exchange Server,Microsoft OWA Exchange Control Panel (ECP) Exploit Chain,2021-11-03,"Microsoft Exchange Server Remote Code Execution Vulnerability. This CVE ID is unique from CVE-2021-26412, CVE-2021-26854, CVE-2021-26857, CVE-2021-26858, CVE-2021-27065, CVE-2021-27078.",Apply updates per vendor instructions.,2021-04-16,,1,2021-03-03,9.8,NVD-CWE-noinfo,NETWORK,LOW,CRITICAL
CVE-2021-26858,microsoft,Microsoft Exchange Server,Microsoft OWA Exchange Control Panel (ECP) Exploit Chain,2021-11-03,"Microsoft Exchange Server Remote Code Execution Vulnerability. This CVE ID is unique from CVE-2021-26412, CVE-2021-26854, CVE-2021-26855, CVE-2021-26857, CVE-2021-27065, CVE-2021-27078.",Apply updates per vendor instructions.,2021-04-16,,1,2021-03-03,7.8,NVD-CWE-noinfo,LOCAL,LOW,HIGH
CVE-2021-27065,microsoft,Microsoft Exchange Server,Microsoft OWA Exchange Control Panel (ECP) Exploit Chain,2021-11-03,"Microsoft Exchange Server Remote Code Execution Vulnerability. This CVE ID is unique from CVE-2021-26412, CVE-2021-26854, CVE-2021-26855, CVE-2021-26857, CVE-2021-26858, CVE-2021-27078.",Apply updates per vendor instructions.,2021-04-16,,1,2021-03-03,7.8,NVD-CWE-noinfo,LOCAL,LOW,HIGH
CVE-2020-1054,microsoft,Win32k,Microsoft Win32k Privilege Escalation Vulnerability,2021-11-03,A privilege escalation vulnerability exists in Windows when the Windows kernel-mode driver fails to properly handle objects in memory,Apply updates per vendor instructions.,2022-05-03,,1,2020-05-21,7.8,CWE-787,LOCAL,LOW,HIGH
CVE-2021-1675,microsoft,Windows,Microsoft Windows Print Spooler Remote Code Execution Vulnerability,2021-11-03,Windows Print Spooler Privilege Escalation Vulnerability,Apply updates per vendor instructions.,2021-11-17,,1,2021-06-08,8.8,CWE-269,NETWORK,LOW,HIGH
CVE-2021-34448,microsoft,Scripting Engine,Microsoft Scripting Engine Memory Corruption Vulnerability,2021-11-03,Scripting Engine Memory Corruption Vulnerability,Apply updates per vendor instructions.,2021-11-17,,1,2021-07-16,8.8,CWE-787,NETWORK,LOW,HIGH
CVE-2020-0601,microsoft,Windows CryptoAPI,Microsoft Windows 10 API/ECC Vulnerability,2021-11-03,"A spoofing vulnerability exists in the way Windows CryptoAPI (Crypt32.dll) validates Elliptic Curve Cryptography (ECC) certificates. An attacker could exploit the vulnerability by using a spoofed code-signing certificate to sign a malicious executable, making it appear the file was from a trusted, legitimate source, aka 'Windows CryptoAPI Spoofing Vulnerability'.",Apply updates per vendor instructions.,2020-01-29,,1,2020-01-14,8.1,CWE-295,NETWORK,LOW,HIGH
CVE-2019-0604,microsoft,SharePoint,Microsoft SharePoint Remote Code Execution Vulnerability,2021-11-03,"A remote code execution vulnerability exists in Microsoft SharePoint when the software fails to check the source markup of an application package, aka 'Microsoft SharePoint Remote Code Execution Vulnerability'. This CVE ID is unique from CVE-2019-0594.",Apply updates per vendor instructions.,2022-05-03,,1,2019-03-05,9.8,CWE-20,NETWORK,LOW,CRITICAL
CVE-2020-0646,microsoft,Microsoft .NET Framework,Microsoft .NET Framework Remote Code Execution Vulnerability,2021-11-03,"A remote code execution vulnerability exists when the Microsoft .NET Framework fails to validate input properly, aka '.NET Framework Remote Code Execution Injection Vulnerability'.",Apply updates per vendor instructions.,2022-05-03,,1,2020-01-14,9.8,CWE-78,NETWORK,LOW,CRITICAL
CVE-2019-0808,microsoft,Windows,Microsoft Windows 7 win32k.sys Driver Vulnerability,2021-11-03,"A privilege escalation vulnerability exists in Windows when the Win32k component fails to properly handle objects in memory, aka 'Win32k Elevation of Privilege Vulnerability'. This CVE ID is unique from CVE-2019-0797.",Apply updates per vendor instructions.,2022-05-03,,1,2019-04-09,7.8,NVD-CWE-noinfo,LOCAL,LOW,HIGH
CVE-2021-26857,microsoft,Microsoft Exchange Server,Microsoft Unified Messaging Deserialization Vulnerability,2021-11-03,"Microsoft Exchange Server Remote Code Execution Vulnerability. This CVE ID is unique from CVE-2021-26412, CVE-2021-26854, CVE-2021-26855, CVE-2021-26858, CVE-2021-27065, CVE-2021-27078.",Apply updates per vendor instructions.,2021-04-16,,1,2021-03-03,7.8,NVD-CWE-noinfo,LOCAL,LOW,HIGH
CVE-2020-1147,microsoft,"Microsoft .NET Framework, Microsoft SharePoint, Visual Studio","Microsoft .NET Framework, SharePoint Server, and Visual Studio Remote Code Execution Vulnerability",2021-11-03,"A remote code execution vulnerability exists in .NET Framework, Microsoft SharePoint, and Visual Studio when the software fails to check the source markup of XML file input.",Apply updates per vendor instructions.,2022-05-03,,1,2020-07-14,7.8,NVD-CWE-noinfo,LOCAL,LOW,HIGH
CVE-2019-1214,microsoft,Windows,Microsoft Windows Common Log File System (CLFS) Driver Vulnerability,2021-11-03,"A privilege escalation vulnerability exists when the Windows Common Log File System (CLFS) driver improperly handles objects in memory, aka 'Windows Common Log File System Driver Elevation of Privilege Vulnerability'.",Apply updates per vendor instructions.,2022-05-03,,1,2019-09-11,7.8,NVD-CWE-noinfo,LOCAL,LOW,HIGH
CVE-2016-3235,microsoft,Microsoft Visio/Office,Microsoft Visio/Office OLE DLL Side Loading vulnerability,2021-11-03,"Allows local users to gain privileges via a crafted application, aka ""Microsoft Office OLE DLL Side Loading Vulnerability.""",Apply updates per vendor instructions.,2022-05-03,,1,2016-06-16,7.8,CWE-264,LOCAL,LOW,HIGH
CVE-2019-0863,microsoft,Windows,Microsoft Windows Error Reporting (WER) Vulnerability,2021-11-03,"A privilege escalation vulnerability exists in the way Windows Error Reporting (WER) handles files, aka 'Windows Error Reporting Elevation of Privilege Vulnerability'.",Apply updates per vendor instructions.,2022-05-03,,1,2019-05-16,7.8,NVD-CWE-noinfo,LOCAL,LOW,HIGH
CVE-2021-36955,microsoft,Windows,Microsoft Windows Common Log File System (CLFS) Driver Privilege Escalation Vulnerability,2021-11-03,Microsoft Windows Common Log File System Driver contains an unspecified vulnerability which allows for privilege escalation.,Apply updates per vendor instructions.,2021-11-17,,1,2021-09-15,7.8,CWE-269,LOCAL,LOW,HIGH
CVE-2021-38648,microsoft,Microsoft Azure Open Management Infrastructure (OMI),Microsoft Azure Open Management Infrastructure (OMI) Privilege Escalation Vulnerability,2021-11-03,Open Management Infrastructure Privilege Escalation Vulnerability,Apply updates per vendor instructions.,2021-11-17,,1,2021-09-15,7.8,CWE-269,LOCAL,LOW,HIGH
CVE-2020-6819,mozilla,nsDocShell destructor,Mozilla Firefox 74 and Firefox ESR 68.6 nsDocShell vulnerability,2021-11-03,"A race condition can cause a use-after-free when running the nsDocShell destructor. This vulnerability affects Thunderbird < 68.7.0, Firefox < 74.0.1, and Firefox ESR < 68.6.1.",Apply updates per vendor instructions.,2022-05-03,,1,2020-04-24,8.1,"CWE-787,CWE-416",NETWORK,HIGH,HIGH
CVE-2020-6820,mozilla,ReadableStream,Mozilla Firefox 74 and Firefox ESR 68.6 ReadableStream vulnerability,2021-11-03,"A race condition can cause a use-after-free when handling a ReadableStream. This vulnerability affects Thunderbird < 68.7.0, Firefox < 74.0.1, and Firefox ESR < 68.6.1.",Apply updates per vendor instructions.,2022-05-03,,1,2020-04-24,8.1,"CWE-362,CWE-416",NETWORK,HIGH,HIGH
CVE-2019-17026,mozilla,IonMonkey JIT compiler,Mozilla Firefox IonMonkey JIT compiler Type Confusion Vulnerability,2021-11-03,"Incorrect alias information in IonMonkey JIT compiler for setting array elements could lead to a type confusion. This vulnerability affects Firefox ESR < 68.4.1, Thunderbird < 68.4.1, and Firefox < 72.0.1",Apply updates per vendor instructions.,2022-05-03,,1,2020-03-02,8.8,CWE-843,NETWORK,LOW,HIGH
CVE-2019-15949,nagios,Nagios XI,Nagios XI Remote Code Execution Vulnerability,2021-11-03,"The exploit requires access to the server as the nagios user, or access as the admin user via the web interface. The getprofile.sh script, invoked by downloading a system profile (profile.php?cmd=download), is executed as root via a passwordless sudo entry; the script executes check_plugin, which is owned by the nagios user",Apply updates per vendor instructions.,2022-05-03,,1,2019-09-05,8.8,CWE-78,NETWORK,LOW,HIGH
CVE-2020-26919,netgear,NETGEAR JGS516PE devices,Netgear ProSAFE Plus JGS516PE Remote Code Execution vulnerability,2021-11-03,NETGEAR JGS516PE devices before 2.6.0.43 are affected by lack of access control at the function level.,Apply updates per vendor instructions.,2022-05-03,,1,2020-10-09,9.8,NVD-CWE-Other,NETWORK,LOW,CRITICAL
CVE-2019-19356,netis,Netis WF2419,Netis WF2419 Router Tracert Remote Code Execution vulnerability,2021-11-03,Netis WF2419 is vulnerable to authenticated Remote Code Execution (RCE) as root through the router Web management page. The vulnerability has been found in firmware version V1.2.31805 and V2.2.36123,Apply updates per vendor instructions.,2022-05-03,,1,2020-02-07,7.5,CWE-78,NETWORK,HIGH,HIGH
CVE-2020-2555,oracle,Oracle Coherence,Oracle Coherence Deserialization Remote Code Execution,2021-11-03,Allows unauthenticated attacker with network access via T3 to compromise Oracle Coherence. Successful attacks of this vulnerability can result in takeover of Oracle Coherence,Apply updates per vendor instructions.,2022-05-03,,1,2020-01-15,9.8,NVD-CWE-noinfo,NETWORK,LOW,CRITICAL
CVE-2012-3152,oracle,Oracle Reports Developer,Oracle Reports Developer Arbitrary File Read and Upload vulnerability,2021-11-03,Allows remote attackers to affect confidentiality and integrity via unknown vectors related to Report Server Component.,Apply updates per vendor instructions.,2022-05-03,,1,2012-10-16,NA,NVD-CWE-noinfo,NA,NA,NA
CVE-2020-14871,oracle,Oracle Solaris,Oracle Solaris Pluggable Authentication Module vulnerability,2021-11-03,Easily exploitable vulnerability allows unauthenticated attacker with network access via multiple protocols to compromise Oracle Solaris.,Apply updates per vendor instructions.,2022-05-03,,1,2020-10-21,10,CWE-787,NETWORK,LOW,CRITICAL
CVE-2015-4852,oracle,Oracle WebLogic Server,Oracle WebLogic Server Remote Code Execution Vulnerability,2021-11-03,"Allows remote attackers to execute arbitrary commands via a crafted serialized Java object in T3 protocol traffic to TCP port 7001, related to oracle_common/modules/com.bea.core.apache.commons.collections.jar.",Apply updates per vendor instructions.,2022-05-03,,1,2015-11-18,NA,CWE-77,NA,NA,NA
CVE-2020-14750,oracle,Oracle WebLogic Server,Oracle WebLogic Server Remote Code Execution Vulnerability,2021-11-03,Easily exploitable vulnerability allows unauthenticated attacker with network access via HTTP to compromise Oracle WebLogic Server.,Apply updates per vendor instructions.,2022-05-03,,1,2020-11-02,9.8,NVD-CWE-noinfo,NETWORK,LOW,CRITICAL
CVE-2020-14882,oracle,Oracle WebLogic Server,Oracle WebLogic Server Remote Code Execution Vulnerability,2021-11-03,Easily exploitable vulnerability allows unauthenticated attacker with network access via HTTP to compromise Oracle WebLogic Server.,Apply updates per vendor instructions.,2022-05-03,,1,2020-10-21,9.8,NVD-CWE-noinfo,NETWORK,LOW,CRITICAL
CVE-2020-14883,oracle,Oracle WebLogic Server,Oracle WebLogic Server Remote Code Execution Vulnerability,2021-11-03,Easily exploitable vulnerability allows high privileged attacker with network access via HTTP to compromise Oracle WebLogic Server.,Apply updates per vendor instructions.,2022-05-03,,1,2020-10-21,7.2,NVD-CWE-noinfo,NETWORK,LOW,HIGH
CVE-2020-8644,playsms,PlaySMS,PlaySMS Remote Code Execution Vulnerability,2021-11-03,PlaySMS before 1.4.3 does not sanitize inputs from a malicious string.,Apply updates per vendor instructions.,2022-05-03,,1,2020-02-05,9.8,CWE-74,NETWORK,LOW,CRITICAL
CVE-2019-18935,progess,ASP.NET AJAX,Progress Telerik UI for ASP.NET deserialization bug,2021-11-03,Contains a .NET deserialization vulnerability in the RadAsyncUpload function that can result in remote code execution.,Apply updates per vendor instructions.,2022-05-03,,1,2019-12-11,9.8,CWE-502,NETWORK,LOW,CRITICAL
CVE-2021-22893,pulse secure,Pulse Connect Secure,Pulse Connect Secure Remote Code Execution Vulnerability,2021-11-03,Vulnerability to an authentication bypass vulnerability exposed by the Windows File Share Browser and Pulse Secure Collaboration features of Pulse Connect Secure that can allow an unauthenticated user to perform remote arbitrary code execution on the Pulse Connect Secure gateway.,Apply updates per vendor instructions.,2021-04-23,,1,2021-04-23,10,CWE-287,NETWORK,LOW,CRITICAL
CVE-2020-8243,pulse secure,Pulse Connect Secure,Pulse Connect Secure Arbitrary Code Execution,2021-11-03,A vulnerability in the Pulse Connect Secure < 9.1R8.2 admin web interface could allow an authenticated attacker to upload custom template to perform an arbitrary code execution.,Apply updates per vendor instructions.,2021-04-23,,1,2020-09-30,7.2,CWE-94,NETWORK,LOW,HIGH
CVE-2021-22900,pulse secure,Pulse Connect Secure,Pulse Connect Secure Arbitrary File Upload Vulnerability,2021-11-03,A vulnerability allowed multiple unrestricted uploads in Pulse Connect Secure before 9.1R11.4 that could lead to an authenticated administrator to perform a file write via a maliciously crafted archive upload in the administrator web interface.,Apply updates per vendor instructions.,2021-04-23,,1,2021-05-27,7.2,CWE-94,NETWORK,LOW,HIGH
CVE-2021-22894,pulse secure,Pulse Connect Secure,Pulse Connect Secure Collaboration Suite Remote Code Execution Vulnerability,2021-11-03,A buffer overflow vulnerability exists in Pulse Connect Secure before 9.1R11.4 allows a remote authenticated attacker to execute arbitrary code as the root user via maliciously crafted meeting room.,Apply updates per vendor instructions.,2021-04-23,,1,2021-05-27,8.8,CWE-120,NETWORK,LOW,HIGH
CVE-2020-8260,pulse secure,Pulse Connect Secure,Pulse Connect Secure Remote Code Execution Vulnerability,2021-11-03,A vulnerability in the Pulse Connect Secure < 9.1R9 admin web interface could allow an authenticated attacker to perform an arbitrary code execution using uncontrolled gzip extraction.,Apply updates per vendor instructions.,2021-04-23,,1,2020-10-28,7.2,CWE-434,NETWORK,LOW,HIGH
CVE-2021-22899,pulse secure,Pulse Connect Secure,Pulse Connect Secure Remote Code Execution Vulnerability,2021-11-03,Allows a remote authenticated attacker to perform remote code execution via Windows Resource Profiles Feature.,Apply updates per vendor instructions.,2021-04-23,,1,2021-05-27,8.8,CWE-77,NETWORK,LOW,HIGH
CVE-2019-11510,pulse secure,Pulse Connect Secure,Pulse Connect Secure VPN arbitrary file reading vulnerability (COVID-19-CTI list),2021-11-03,An unauthenticated remote attacker can send a specially crafted URI to perform an arbitrary file reading vulnerability.,Apply updates per vendor instructions.,2021-04-23,,1,2019-05-08,10,CWE-22,NETWORK,LOW,CRITICAL
CVE-2019-11539,pulse secure,"Pulse Connect Secure, Policy Secure",Pulse Connect Secure and Policy Secure Multiple Versions Code Execution,2021-11-03,Pulse Secure's Connect and Policy secure platforms contain a vulnerability in the admin web interface which allows an attacker to inject and execute commands.,Apply updates per vendor instructions.,2022-05-03,,1,2019-04-26,7.2,CWE-78,NETWORK,LOW,HIGH
CVE-2021-1906,qualcomm,"Snapdragon Auto, Snapdragon Compute, Snapdragon Connectivity, Snapdragon Consumer IOT, Snapdragon Industrial IOT, Snapdragon Mobile, Snapdragon Voice & Music, Snapdragon Wearables",Qualcomm Improper Error Handling Vulnerability,2021-11-03,Improper handling of address deregistration on failure can lead to new GPU address allocation failure.,Apply updates per vendor instructions.,2021-11-17,,1,2021-05-07,5.5,CWE-755,LOCAL,LOW,MEDIUM
CVE-2021-1905,qualcomm,"Snapdragon Auto, Snapdragon Compute, Snapdragon Connectivity, Snapdragon Consumer IOT, Snapdragon Industrial IOT, Snapdragon Mobile, Snapdragon Voice & Music, Snapdragon Wearables",Qualcomm Use-After-Free Vulnerability,2021-11-03,Possible use after free due to improper handling of memory mapping of multiple processes simultaneously,Apply updates per vendor instructions.,2022-05-03,,1,2021-05-07,7.8,CWE-416,LOCAL,LOW,HIGH
CVE-2020-10221,rconfig,rConfig,rConfig Remote Code Execution Vulnerability,2021-11-03,lib/ajaxHandlers/ajaxAddTemplate.php in rConfig through 3.94 allows remote attackers to execute arbitrary OS commands via shell metacharacters in the fileName POST parameter.,Apply updates per vendor instructions.,2022-05-03,,1,2020-03-08,8.8,CWE-78,NETWORK,LOW,HIGH
CVE-2021-35395,realtek,Jungle Software Development Kit (SDK),Realtek SDK Arbitrary Code Execution,2021-11-03,Realtek Jungle SDK version v2.x up to v3.4.14B arbitrary code execution.,Apply updates per vendor instructions.,2021-11-17,,1,2021-08-16,9.8,"CWE-77,CWE-787",NETWORK,LOW,CRITICAL
CVE-2017-16651,roundcube,Roundcube Webmail,Roundcube Webmail File Disclosure Vulnerability,2021-11-03,"Allows unauthorized access to arbitrary files on the host's filesystem, including configuration files. The issue is related to file-based attachment plugins and _task=settings&_action=upload-display&_from=timezone requests.",Apply updates per vendor instructions.,2022-05-03,,1,2017-11-09,7.8,CWE-552,LOCAL,LOW,HIGH
CVE-2020-11652,saltstack,Salt,SaltStack directory traversal failure to sanitize untrusted input,2021-11-03,The salt-master process ClearFuncs class allows access to some methods that improperly sanitize paths. These methods allow arbitrary directory access to authenticated users.,Apply updates per vendor instructions.,2022-05-03,,1,2020-04-30,6.5,CWE-22,NETWORK,LOW,MEDIUM
CVE-2020-11651,saltstack,Salt,SaltStack Salt Authentication Bypass,2021-11-03,The salt-master process ClearFuncs class does not properly validate method calls. This allows a remote user to access some methods without authentication.,Apply updates per vendor instructions.,2022-05-03,,1,2020-04-30,9.8,CWE-306,NETWORK,LOW,CRITICAL
CVE-2020-16846,saltstack,Salt,SaltStack Through 3002 Shell Injection Vulnerability,2021-11-03,"An issue was discovered in SaltStack Salt through 3002. Sending crafted web requests to the Salt API, with the SSH client enabled, can result in shell injection.",Apply updates per vendor instructions.,2022-05-03,,1,2020-11-06,9.8,CWE-78,NETWORK,LOW,CRITICAL
CVE-2018-2380,sap,SAP CRM,SAP NetWeaver AS JAVA CRM Remote Code Execution Vulnerability,2021-11-03,"SAP CRM, 7.01, 7.02,7.30, 7.31, 7.33, 7.54, allows an attacker to exploit insufficient validation of path information provided by users, thus characters representing ""traverse to parent directory"" are passed through to the file APIs.",Apply updates per vendor instructions.,2022-05-03,,1,2018-03-01,6.6,CWE-22,NETWORK,LOW,MEDIUM
CVE-2010-5326,sap,SAP NetWeaver Application Server Java platforms,SAP NetWeaver AS JAVA Remote Code Execution Vulnerability,2021-11-03,"The Invoker Servlet on SAP NetWeaver Application Server Java platforms, possibly before 7.3, does not require authentication, which allows remote attackers to execute arbitrary code via an HTTP or HTTPS request.",Apply updates per vendor instructions.,2022-05-03,,1,2016-05-13,10,NVD-CWE-noinfo,NETWORK,LOW,CRITICAL
CVE-2016-9563,sap,SAP NetWeaver AS JAVA,SAP NetWeaver AS JAVA XXE Vulnerability,2021-11-03,"BC-BMT-BPM-DSK in SAP NetWeaver AS JAVA 7.5 allows remote authenticated users to conduct XML External Entity (XXE) attacks via the sap.com~tc~bpem~him~uwlconn~provider~web/bpemuwlconn URI, aka SAP Security Note 2296909.",Apply updates per vendor instructions.,2022-05-03,,1,2016-11-23,6.5,CWE-611,NETWORK,LOW,MEDIUM
CVE-2020-6287,sap,SAP NetWeaver AS JAVA (LM Configuration Wizard),SAP Netweaver JAVA remote unauthenticated access vulnerability,2021-11-03,"SAP NetWeaver AS JAVA (LM Configuration Wizard), versions - 7.30, 7.31, 7.40, 7.50, does not perform an authentication check which allows an attacker without prior authentication to execute configuration tasks to perform critical actions against the SAP Java system.",Apply updates per vendor instructions.,2022-05-03,,1,2020-07-14,10,CWE-306,NETWORK,LOW,CRITICAL
CVE-2020-6207,sap,SAP Solution Manager (User Experience Monitoring),SAP Solution Manager Missing Authentication Check Complete Compromise of SMD Agents vulnerability,2021-11-03,"SAP Solution Manager (User Experience Monitoring), version- 7.2, due to Missing Authentication Check does not perform any authentication for a service resulting in complete compromise of all SMDAgents connected to the Solution Manager.",Apply updates per vendor instructions.,2022-05-03,,1,2020-03-10,9.8,CWE-306,NETWORK,LOW,CRITICAL
CVE-2016-3976,sap,SAP NetWeaver AS Java,SAP NetWeaver AS Java 7.1 - 7.5 Directory Traversal Vulnerability,2021-11-03,"Directory traversal vulnerability in SAP NetWeaver AS Java 7.1 through 7.5 allows remote attackers to read arbitrary files via a ..\ (dot dot backslash) in the fileName parameter to CrashFileDownloadServlet, aka SAP Security Note 2234971.",Apply updates per vendor instructions.,2022-05-03,,1,2016-04-07,7.5,CWE-22,NETWORK,LOW,HIGH
CVE-2019-16256,simalliance,SIMalliance Toolbox (S@T) Browser,SIMalliance Toolbox (S@T) Browser Command and Control Vulnerability,2021-11-03,"Some Samsung devices include the SIMalliance Toolbox Browser (aka S@T Browser) on the UICC, which might allow remote attackers to retrieve location and IMEI information, or retrieve other data or execute certain commands, via SIM Toolkit (STK) instructions in an SMS message, aka Simjacker.",Apply updates per vendor instructions.,2022-05-03,,1,2019-09-12,9.8,NVD-CWE-noinfo,NETWORK,LOW,CRITICAL
CVE-2020-10148,solarwinds,SolarWinds Orion Platform,SolarWinds Orion API Authentication Bypass Vulnerability,2021-11-03,"The SolarWinds Orion API is vulnerable to an authentication bypass that could allow a remote attacker to execute API commands. SolarWinds Orion Platform versions 2019.4 HF 5, 2020.2 with no hotfix installed, and 2020.2 HF 1 are affected.",Apply updates per vendor instructions.,2022-05-03,,1,2020-12-29,9.8,CWE-287,NETWORK,LOW,CRITICAL
CVE-2021-35211,solarwinds,SolarWinds nServ-U,SolarWinds Serv-U Remote Memory Escape Vulnerability,2021-11-03,Microsoft discovered a remote code execution (RCE) vulnerability in the SolarWinds Serv-U product utilizing a Remote Memory Escape Vulnerability.,Apply updates per vendor instructions.,2021-11-17,,1,2021-07-14,10,CWE-668,NETWORK,LOW,CRITICAL
CVE-2016-3643,solarwinds,SolarWinds Virtualization Manager,SolarWinds Virtualization Manager Privilege Escalation Vulnerability,2021-11-03,"SolarWinds Virtualization Manager 6.3.1 and earlier allow local users to gain privileges by leveraging a misconfiguration of sudo, as demonstrated by ""sudo cat /etc/passwd.""",Apply updates per vendor instructions.,2022-05-03,,1,2016-06-17,7.8,CWE-264,LOCAL,LOW,HIGH
CVE-2020-10199,sonatype,Sonatype Nexus Repository,Nexus Repository Manager 3 Remote Code Execution Vulnerability,2021-11-03,Sonatype Nexus Repository before 3.21.2 allows JavaEL Injection (issue 1 of 2).,Apply updates per vendor instructions.,2022-05-03,,1,2020-04-01,8.8,CWE-917,NETWORK,LOW,HIGH
CVE-2021-20021,sonicwall,SonicWall Email Security,SonicWall Email Security Privilege Escalation Exploit Chain,2021-11-03,A vulnerability in the SonicWall Email Security version 10.0.9.x allows an attacker to create an administrative account by sending a crafted HTTP request to the remote host.,Apply updates per vendor instructions.,2021-11-17,,1,2021-04-09,9.8,CWE-269,NETWORK,LOW,CRITICAL
CVE-2019-7481,sonicwall,SMA100,SonicWall SMA100 9.0.0.3 and Earlier SQL Injection,2021-11-03,Vulnerability in SonicWall SMA100 versions 9.0.0.3 and earlier allow an unauthenticated user to gain read-only access to unauthorized resources.,Apply updates per vendor instructions.,2022-05-03,,1,2019-12-17,7.5,CWE-89,NETWORK,LOW,HIGH
CVE-2021-20022,sonicwall,SonicWall Email Security,SonicWall Email Security Privilege Escalation Exploit Chain,2021-11-03,SonicWall Email Security version 10.0.9.x contains a vulnerability that allows a post-authenticated attacker to upload an arbitrary file to the remote host.,Apply updates per vendor instructions.,2021-11-17,,1,2021-04-09,7.2,CWE-434,NETWORK,LOW,HIGH
CVE-2021-20023,sonicwall,SonicWall Email Security,SonicWall Email Security Privilege Escalation Exploit Chain,2021-11-03,SonicWall Email Security version 10.0.9.x contains a vulnerability that allows a post-authenticated attacker to read an arbitrary file on the remote host.,Apply updates per vendor instructions.,2021-11-17,,1,2021-04-20,4.9,CWE-22,NETWORK,LOW,MEDIUM
