cve_id,vendor_project,product,vulnerability_name,date_added,short_description,required_action,due_date,notes,grp,pub_date,cvss,cwe,vector,complexity,severity
CVE-2020-2021,palo alto,PAN-OS,Palo Alto PAN-OS Authentication Bypass Vulnerability,2022-03-25,Palo Alto PAN-OS contains a vulnerability in SAML which allows an attacker to bypass authentication.,Apply updates per vendor instructions.,2022-04-15,,19,2020-06-29,10,CWE-347,NETWORK,LOW,CRITICAL
CVE-2020-1956,apache,Kylin,Apache Kylin OS Command Injection Vulnerability,2022-03-25,Apache Kylin contains an OS command injection vulnerability which could permit an attacker to perform remote code execution.,Apply updates per vendor instructions.,2022-04-15,,19,2020-05-22,8.8,CWE-78,NETWORK,LOW,HIGH
CVE-2020-1631,juniper,Junos OS,Juniper Junos OS Path Traversal Vulnerability,2022-03-25,"A path traversal vulnerability in the HTTP/HTTPS service used by J-Web, Web Authentication, Dynamic-VPN (DVPN), Firewall Authentication Pass-Through with Web-Redirect, and Zero Touch Provisioning (ZTP) allows an unauthenticated attacker to perform remote code execution.",Apply updates per vendor instructions.,2022-04-15,,19,2020-05-04,9.8,CWE-22,NETWORK,LOW,CRITICAL
CVE-2019-6340,drupal,Core,Drupal Core Remote Code Execution Vulnerability,2022-03-25,"In Drupal Core, some field types do not properly sanitize data from non-form sources. This can lead to arbitrary PHP code execution in some cases.",Apply updates per vendor instructions.,2022-04-15,,19,2019-02-21,8.1,CWE-502,NETWORK,HIGH,HIGH
CVE-2019-2616,oracle,BI Publisher (Formerly XML Publisher),Oracle BI Publisher Unauthorized Access Vulnerability,2022-03-25,"Oracle BI Publisher, formerly XML Publisher, contains an unspecified vulnerability which allows for various unauthorized actions. Open-source reporting attributes this vulnerability to allowing for authentication bypass.",Apply updates per vendor instructions.,2022-04-15,,19,2019-04-23,7.2,NVD-CWE-noinfo,NETWORK,LOW,HIGH
CVE-2019-16920,d-link,Multiple Routers,D-Link Multiple Routers Command Injection Vulnerability,2022-03-25,Multiple D-Link routers contain a command injection vulnerability which can allow attackers to achieve full system compromise.,The impacted product is end-of-life and should be disconnected if still in use.,2022-04-15,,19,2019-09-27,9.8,CWE-78,NETWORK,LOW,CRITICAL
CVE-2019-15107,webmin,Webmin,Webmin Command Injection Vulnerability,2022-03-25,An issue was discovered in Webmin. The parameter old in password_change.cgi contains a command injection vulnerability.,Apply updates per vendor instructions.,2022-04-15,,19,2019-08-16,9.8,CWE-78,NETWORK,LOW,CRITICAL
CVE-2019-12991,citrix,SD-WAN and NetScaler,Citrix SD-WAN and NetScaler Command Injection Vulnerability,2022-03-25,Authenticated Command Injection in Citrix SD-WAN Appliance and NetScaler SD-WAN Appliance.,Apply updates per vendor instructions.,2022-04-15,,19,2019-07-16,8.8,CWE-78,NETWORK,LOW,HIGH
CVE-2019-12989,citrix,SD-WAN and NetScaler,Citrix SD-WAN and NetScaler SQL Injection Vulnerability,2022-03-25,Citrix SD-WAN and NetScaler SD-WAN allow SQL Injection.,Apply updates per vendor instructions.,2022-04-15,,19,2019-07-16,9.8,CWE-89,NETWORK,LOW,CRITICAL
CVE-2019-11043,php,FastCGI Process Manager (FPM),PHP FastCGI Process Manager (FPM) Buffer Overflow Vulnerability,2022-03-25,"In some versions of PHP in certain configurations of FPM setup, it is possible to cause FPM module to write past allocated buffers allowing the possibility of remote code execution.",Apply updates per vendor instructions.,2022-04-15,,19,2019-10-28,9.8,CWE-787,NETWORK,LOW,CRITICAL
CVE-2019-10068,kentico,Xperience,Kentico Xperience Deserialization of Untrusted Data Vulnerability,2022-03-25,Kentico contains a failure to validate security headers. This deserialization can led to unauthenticated remote code execution.,Apply updates per vendor instructions.,2022-04-15,,19,2019-03-26,9.8,CWE-502,NETWORK,LOW,CRITICAL
CVE-2019-1003030,jenkins,Matrix Project Plugin,Jenkins Matrix Project Plugin Remote Code Execution Vulnerability,2022-03-25,"Jenkins Matrix Project plugin contains a vulnerability which can allow users to escape the sandbox, opening opportunity to perform remote code execution.",Apply updates per vendor instructions.,2022-04-15,,19,2019-03-08,9.9,CWE-693,NETWORK,LOW,CRITICAL
CVE-2019-0903,microsoft,Graphics Device Interface (GDI),Microsoft GDI Remote Code Execution Vulnerability,2022-03-25,A remote code execution vulnerability exists in the way that the Windows Graphics Device Interface (GDI) handles objects in the memory. An attacker who successfully exploited this vulnerability could take control of the affected system.,Apply updates per vendor instructions.,2022-04-15,,19,2019-05-16,8.8,NVD-CWE-noinfo,NETWORK,LOW,HIGH
CVE-2018-8414,microsoft,Windows,Microsoft Windows Shell Remote Code Execution Vulnerability,2022-03-25,A remote code execution vulnerability exists when the Windows Shell does not properly validate file paths.,Apply updates per vendor instructions.,2022-04-15,,19,2018-08-15,8.8,CWE-20,NETWORK,LOW,HIGH
CVE-2018-8373,microsoft,Internet Explorer Scripting Engine,Microsoft Scripting Engine Memory Corruption Vulnerability,2022-03-25,A remote code execution vulnerability exists in the way that the scripting engine handles objects in memory in Internet Explorer.,Apply updates per vendor instructions.,2022-04-15,,19,2018-08-15,7.5,CWE-787,NETWORK,HIGH,HIGH
CVE-2018-6961,vmware,SD-WAN Edge,VMware SD-WAN Edge by VeloCloud Command Injection Vulnerability,2022-03-25,VMware SD-WAN Edge by VeloCloud contains a command injection vulnerability in the local web UI component. Successful exploitation of this issue could result in remote code execution.,Apply updates per vendor instructions.,2022-04-15,,19,2018-06-11,8.1,CWE-78,NETWORK,HIGH,HIGH
CVE-2018-14839,lg,N1A1 NAS,LG N1A1 NAS Remote Command Execution Vulnerability,2022-03-25,LG N1A1 NAS 3718.510 is affected by a remote code execution vulnerability.,Apply updates per vendor instructions.,2022-04-15,,19,2019-05-14,9.8,CWE-78,NETWORK,LOW,CRITICAL
CVE-2018-1273,vmware tanzu,Spring Data Commons,VMware Tanzu Spring Data Commons Property Binder Vulnerability,2022-03-25,Spring Data Commons contains a property binder vulnerability which can allow an attacker to perform remote code execution.,Apply updates per vendor instructions.,2022-04-15,,19,2018-04-11,9.8,CWE-20,NETWORK,LOW,CRITICAL
CVE-2018-11138,quest,KACE System Management Appliance,Quest KACE System Management Appliance Remote Command Execution Vulnerability,2022-03-25,The '/common/download_agent_installer.php' script in the Quest KACE System Management Appliance is accessible by anonymous users and can be abused to perform remote code execution.,Apply updates per vendor instructions.,2022-04-15,,19,2018-05-31,9.8,CWE-78,NETWORK,LOW,CRITICAL
CVE-2018-0147,cisco,Secure Access Control System (ACS),Cisco Secure Access Control System Java Deserialization Vulnerability,2022-03-25,"A vulnerability in Java deserialization used by Cisco Secure Access Control System (ACS) could allow an unauthenticated, remote attacker to execute arbitrary commands on an affected device. The vulnerability is due to insecure deserialization of user-supplied content by the affected software.",Apply updates per vendor instructions.,2022-04-15,,19,2018-03-08,9.8,CWE-502,NETWORK,LOW,CRITICAL
CVE-2018-0125,cisco,VPN Routers,Cisco VPN Routers Remote Code Execution Vulnerability,2022-03-25,"A vulnerability in the web interface of the Cisco VPN Routers could allow an unauthenticated, remote attacker to execute arbitrary code as root and gain full control of an affected system.",Apply updates per vendor instructions.,2022-04-15,,19,2018-02-08,9.8,CWE-20,NETWORK,LOW,CRITICAL
CVE-2017-6334,netgear,DGN2200 Devices,NETGEAR DGN2200 Devices OS Command Injection Vulnerability,2022-03-25,dnslookup.cgi on NETGEAR DGN2200 devices with firmware through 10.0.0.50 allows remote authenticated users to execute arbitrary OS commands,The impacted product is end-of-life and should be disconnected if still in use.,2022-04-15,,19,2017-03-06,8.8,CWE-78,NETWORK,LOW,HIGH
CVE-2017-6316,citrix,"NetScaler SD-WAN Enterprise, CloudBridge Virtual WAN, and XenMobile Server",Citrix Multiple Products Remote Code Execution Vulnerability,2022-03-25,"A vulnerability has been identified in the management interface of Citrix NetScaler SD-WAN Enterprise and Standard Edition and Citrix CloudBridge Virtual WAN Edition that could result in an unauthenticated, remote attacker being able to execute arbitrary code as a root user. This vulnerability also affects XenMobile Server.",Apply updates per vendor instructions.,2022-04-15,,19,2017-07-20,9.8,CWE-20,NETWORK,LOW,CRITICAL
CVE-2017-3881,cisco,IOS and IOS XE,Cisco IOS and IOS XE Remote Code Execution Vulnerability,2022-03-25,"A vulnerability in the Cisco Cluster Management Protocol (CMP) processing code in Cisco IOS and Cisco IOS XE Software could allow an unauthenticated, remote attacker to cause a reload of an affected device or remotely execute code with elevated privileges.",Apply updates per vendor instructions.,2022-04-15,,19,2017-03-17,9.8,CWE-20,NETWORK,LOW,CRITICAL
CVE-2017-12617,apache,Tomcat,Apache Tomcat Remote Code Execution Vulnerability,2022-03-25,"When running Apache Tomcat, it is possible to upload a JSP file to the server via a specially crafted request. This JSP could then be requested and any code it contained would be executed by the server.",Apply updates per vendor instructions.,2022-04-15,,19,2017-10-04,8.1,CWE-434,NETWORK,HIGH,HIGH
CVE-2017-12615,apache,Tomcat,Apache Tomcat on Windows Remote Code Execution Vulnerability,2022-03-25,"When running Apache Tomcat on Windows with HTTP PUTs enabled, it is possible to upload a JSP file to the server via a specially crafted request. This JSP could then be requested and any code it contained would be executed by the server.",Apply updates per vendor instructions.,2022-04-15,,19,2017-09-19,8.1,CWE-434,NETWORK,HIGH,HIGH
CVE-2017-0146,microsoft,Windows,Microsoft Windows SMB Remote Code Execution Vulnerability,2022-03-25,The SMBv1 server in Microsoft Windows allows remote attackers to perform remote code execution.,Apply updates per vendor instructions.,2022-04-15,,19,2017-03-17,8.1,CWE-20,NETWORK,HIGH,HIGH
CVE-2016-7892,adobe,Flash Player,Adobe Flash Player Use-After-Free Vulnerability,2022-03-25,Adobe Flash Player has an exploitable use-after-free vulnerability in the TextField class.,The impacted product is end-of-life and should be disconnected if still in use.,2022-04-15,,19,2016-12-15,9.8,CWE-416,NETWORK,LOW,CRITICAL
CVE-2016-4171,adobe,Flash Player,Adobe Flash Player Remote Code Execution Vulnerability,2022-03-25,Unspecified vulnerability in Adobe Flash Player allows for remote code execution.,The impacted product is end-of-life and should be disconnected if still in use.,2022-04-15,,19,2016-06-16,9.8,NVD-CWE-noinfo,NETWORK,LOW,CRITICAL
CVE-2016-1555,netgear,Wireless Access Point (WAP) Devices,NETGEAR Multiple WAP Devices Command Injection Vulnerability,2022-03-25,Multiple NETGEAR Wireless Access Point devices allows unauthenticated web pages to pass form input directly to the command-line interface. Exploitation allows for arbitrary code execution.,Apply updates per vendor instructions.,2022-04-15,,19,2017-04-21,9.8,CWE-77,NETWORK,LOW,CRITICAL
CVE-2016-11021,d-link,DCS-930L Devices,D-Link DCS-930L Devices OS Command Injection Vulnerability,2022-03-25,setSystemCommand on D-Link DCS-930L devices allows a remote attacker to execute code via an OS command.,The impacted product is end-of-life and should be disconnected if still in use.,2022-04-15,,19,2020-03-09,7.2,CWE-78,NETWORK,LOW,HIGH
CVE-2016-10174,netgear,WNR2000v5 Router,NETGEAR WNR2000v5 Router Buffer Overflow Vulnerability,2022-03-25,The NETGEAR WNR2000v5 router contains a buffer overflow which can be exploited to achieve remote code execution.,Apply updates per vendor instructions.,2022-04-15,,19,2017-01-30,9.8,CWE-119,NETWORK,LOW,CRITICAL
CVE-2016-0752,rails,Ruby on Rails,Ruby on Rails Directory Traversal Vulnerability,2022-03-25,Directory traversal vulnerability in Action View in Ruby on Rails allows remote attackers to read arbitrary files.,Apply updates per vendor instructions.,2022-04-15,,19,2016-02-16,7.5,CWE-22,NETWORK,LOW,HIGH
CVE-2015-4068,arcserve,Unified Data Protection (UDP),Arcserve Unified Data Protection (UDP) Directory Traversal Vulnerability,2022-03-25,Directory traversal vulnerability in Arcserve UDP allows remote attackers to obtain sensitive information or cause a denial of service.,Apply updates per vendor instructions.,2022-04-15,,19,2015-05-29,NA,CWE-22,NA,NA,NA
CVE-2015-3035,tp-link,Multiple Archer Devices,TP-Link Multiple Archer Devices Directory Traversal Vulnerability,2022-03-25,Directory traversal vulnerability in multiple TP-Link Archer devices allows remote attackers to read arbitrary files via a .. (dot dot) in the PATH_INFO to login/.,Apply updates per vendor instructions.,2022-04-15,,19,2015-04-22,NA,CWE-22,NA,NA,NA
CVE-2015-1427,elastic,Elasticsearch,Elasticsearch Groovy Scripting Engine Remote Code Execution Vulnerability,2022-03-25,The Groovy scripting engine in Elasticsearch allows remote attackers to bypass the sandbox protection mechanism and execute arbitrary shell commands.,Apply updates per vendor instructions.,2022-04-15,,19,2015-02-17,NA,CWE-284,NA,NA,NA
CVE-2015-1187,d-link and trendnet,Multiple Devices,D-Link and TRENDnet Multiple Devices Remote Code Execution Vulnerability,2022-03-25,The ping tool in multiple D-Link and TRENDnet devices allow remote attackers to perform remote code execution.,The impacted product is end-of-life and should be disconnected if still in use.,2022-04-15,,19,2017-09-21,9.8,CWE-287,NETWORK,LOW,CRITICAL
CVE-2015-0666,cisco,Prime Data Center Network Manager (DCNM),Cisco Prime Data Center Network Manager (DCNM) Directory Traversal Vulnerability,2022-03-25,Directory traversal vulnerability in the fmserver servlet in Cisco Prime Data Center Network Manager (DCNM) allows remote attackers to read arbitrary files.,Apply updates per vendor instructions.,2022-04-15,,19,2015-04-03,NA,CWE-22,NA,NA,NA
CVE-2014-6332,microsoft,Windows,Microsoft Windows Object Linking & Embedding (OLE) Automation Array Remote Code Execution Vulnerability,2022-03-25,OleAut32.dll in OLE in Microsoft Windows allows remote attackers to remotely execute code via a crafted web site.,Apply updates per vendor instructions.,2022-04-15,,19,2014-11-11,NA,CWE-119,NA,NA,NA
CVE-2014-6324,microsoft,Kerberos Key Distribution Center (KDC),Microsoft Kerberos Key Distribution Center (KDC) Privilege Escalation Vulnerability,2022-03-25,The Kerberos Key Distribution Center (KDC) in Microsoft allows remote authenticated domain users to obtain domain administrator privileges.,Apply updates per vendor instructions.,2022-04-15,,19,2014-11-18,NA,CWE-264,NA,NA,NA
CVE-2014-6287,rejetto,HTTP File Server (HFS),Rejetto HTTP File Server (HFS) Remote Code Execution Vulnerability,2022-03-25,The findMacroMarker function in parserLib.pas in Rejetto HTTP File Server (HFS or HttpFileServer) allows remote attackers to execute arbitrary programs.,Apply updates per vendor instructions.,2022-04-15,,19,2014-10-07,9.8,CWE-94,NETWORK,LOW,CRITICAL
CVE-2014-3120,elastic,Elasticsearch,Elasticsearch Remote Code Execution Vulnerability,2022-03-25,"Elasticsearch enables dynamic scripting, which allows remote attackers to execute arbitrary MVEL expressions and Java code.",Apply updates per vendor instructions.,2022-04-15,,19,2014-07-28,NA,CWE-284,NA,NA,NA
CVE-2014-0130,rails,Ruby on Rails,Ruby on Rails Directory Traversal Vulnerability,2022-03-25,Directory traversal vulnerability in actionpack/lib/abstract_controller/base.rb in the implicit-render implementation in Ruby on Rails allows remote attackers to read arbitrary files via a crafted request.,Apply updates per vendor instructions.,2022-04-15,,19,2014-05-07,NA,CWE-22,NA,NA,NA
CVE-2013-5223,d-link,DSL-2760U,D-Link DSL-2760U Gateway Cross-Site Scripting Vulnerability,2022-03-25,"A cross-site scripting (XSS) vulnerability exists in the D-Link DSL-2760U gateway, allowing remote authenticated users to inject arbitrary web script or HTML.",Apply updates per vendor instructions.,2022-04-15,,19,2013-11-19,NA,CWE-79,NA,NA,NA
CVE-2013-4810,hewlett packard (hp),"ProCurve Manager (PCM), PCM+, Identity Driven Manager (IDM), and Application Lifecycle Management",HP Multiple Products Remote Code Execution Vulnerability,2022-03-25,"HP ProCurve Manager (PCM), PCM+, Identity Driven Manager (IDM), and Application Lifecycle Management allow remote attackers to execute arbitrary code via a marshalled object to (1) EJBInvokerServlet or (2) JMXInvokerServlet.",Apply updates per vendor instructions.,2022-04-15,,19,2013-09-16,NA,CWE-94,NA,NA,NA
CVE-2013-2251,apache,Struts,Apache Struts Improper Input Validation Vulnerability,2022-03-25,Apache Struts allows remote attackers to execute arbitrary Object-Graph Navigation Language (OGNL) expressions.,Apply updates per vendor instructions.,2022-04-15,,19,2013-07-20,NA,CWE-20,NA,NA,NA
CVE-2012-1823,php,PHP,PHP-CGI Query String Parameter Vulnerability,2022-03-25,"sapi/cgi/cgi_main.c in PHP, when configured as a CGI script, does not properly handle query strings, which allows remote attackers to execute arbitrary code.",Apply updates per vendor instructions.,2022-04-15,,19,2012-05-11,NA,CWE-20,NA,NA,NA
CVE-2010-4345,exim,Exim,Exim Privilege Escalation Vulnerability,2022-03-25,Exim allows local users to gain privileges by leveraging the ability of the exim user account to specify an alternate configuration file with a directive that contains arbitrary commands.,Apply updates per vendor instructions.,2022-04-15,,19,2010-12-14,NA,CWE-264,NA,NA,NA
CVE-2010-4344,exim,Exim,Exim Heap-Based Buffer Overflow Vulnerability,2022-03-25,Heap-based buffer overflow in the string_vformat function in string.c in Exim before 4.70 allows remote attackers to execute arbitrary code via an SMTP session.,Apply updates per vendor instructions.,2022-04-15,,19,2010-12-14,NA,CWE-119,NA,NA,NA
CVE-2010-3035,cisco,IOS XR,Cisco IOS XR Border Gateway Protocol (BGP) Denial-of-Service Vulnerability,2022-03-25,"Cisco IOS XR, when BGP is the configured routing feature, allows remote attackers to cause a denial-of-service.",Apply updates per vendor instructions.,2022-04-15,,19,2010-08-30,NA,CWE-20,NA,NA,NA
CVE-2010-2861,adobe,ColdFusion,Adobe ColdFusion Directory Traversal Vulnerability,2022-03-25,A directory traversal vulnerability exists in the administrator console in Adobe ColdFusion which allows remote attackers to read arbitrary files.,Apply updates per vendor instructions.,2022-04-15,,19,2010-08-11,NA,CWE-22,NA,NA,NA
CVE-2009-2055,cisco,IOS XR,Cisco IOS XR Border Gateway Protocol (BGP) Denial-of-Service Vulnerability,2022-03-25,"Cisco IOS XR,when BGP is the configured routing feature, allows remote attackers to cause a denial-of-service.",Apply updates per vendor instructions.,2022-04-15,,19,2009-08-19,NA,CWE-20,NA,NA,NA
CVE-2009-1151,phpmyadmin,phpMyAdmin,phpMyAdmin Remote Code Execution Vulnerability,2022-03-25,Setup script used to generate configuration can be fooled using a crafted POST request to include arbitrary PHP code in generated configuration file.,Apply updates per vendor instructions.,2022-04-15,,19,2009-03-26,NA,CWE-94,NA,NA,NA
CVE-2009-0927,adobe,Reader and Acrobat,Adobe Reader and Adobe Acrobat Stack-Based Buffer Overflow Vulnerability,2022-03-25,Stack-based buffer overflow in Adobe Reader and Adobe Acrobat allows remote attackers to execute arbitrary code.,Apply updates per vendor instructions.,2022-04-15,,19,2009-03-19,NA,CWE-20,NA,NA,NA
CVE-2005-2773,hewlett packard (hp),OpenView Network Node Manager,HP OpenView Network Node Manager Remote Code Execution Vulnerability,2022-03-25,HP OpenView Network Node Manager could allow a remote attacker to execute arbitrary commands on the system.,Apply updates per vendor instructions.,2022-04-15,,19,2005-09-02,NA,NVD-CWE-Other,NA,NA,NA
CVE-2022-1096,google,Chromium V8,Google Chromium V8 Type Confusion Vulnerability,2022-03-28,"The vulnerability exists due to a type confusion error within the V8 component in Chromium, affecting all Chromium-based browsers.",Apply updates per vendor instructions.,2022-04-18,,20,NA,NA,NA,NA,NA,NA
CVE-2022-0543,redis,Debian-specific Redis Servers,Debian-specific Redis Server Lua Sandbox Escape Vulnerability,2022-03-28,"Redis is prone to a (Debian-specific) Lua sandbox escape, which could result in remote code execution.",Apply updates per vendor instructions.,2022-04-18,,20,2022-02-18,10,NVD-CWE-noinfo,NETWORK,LOW,CRITICAL
CVE-2021-38646,microsoft,Office,Microsoft Office Access Connectivity Engine Remote Code Execution Vulnerability,2022-03-28,Microsoft Office Access Connectivity Engine contains an unspecified vulnerability which can allow for remote code execution.,Apply updates per vendor instructions.,2022-04-18,,20,2021-09-15,7.8,NVD-CWE-noinfo,LOCAL,LOW,HIGH
CVE-2021-34486,microsoft,Windows,Microsoft Windows Event Tracing Privilege Escalation Vulnerability,2022-03-28,Microsoft Windows Event Tracing contains an unspecified vulnerability which can allow for privilege escalation.,Apply updates per vendor instructions.,2022-04-18,,20,2021-08-12,7.8,CWE-269,LOCAL,LOW,HIGH
CVE-2021-26085,atlassian,Confluence Server,Atlassian Confluence Server Pre-Authorization Arbitrary File Read Vulnerability,2022-03-28,Affected versions of Atlassian Confluence Server allow remote attackers to view restricted resources via a pre-authorization arbitrary file read vulnerability in the /s/ endpoint.,Apply updates per vendor instructions.,2022-04-18,,20,2021-08-03,5.3,CWE-862,NETWORK,LOW,MEDIUM
CVE-2021-20028,sonicwall,Secure Remote Access (SRA),SonicWall Secure Remote Access (SRA) SQL Injection Vulnerability,2022-03-28,SonicWall Secure Remote Access (SRA) products contain an improper neutralization of a SQL Command leading to SQL injection.,The impacted product is end-of-life and should be disconnected if still in use.,2022-04-18,,20,2021-08-04,9.8,CWE-89,NETWORK,LOW,CRITICAL
CVE-2019-7483,sonicwall,SMA100,SonicWall SMA100 Directory Traversal Vulnerability,2022-03-28,"In SonicWall SMA100, an unauthenticated Directory Traversal vulnerability in the handleWAFRedirect CGI allows the user to test for the presence of a file on the server.",Apply updates per vendor instructions.,2022-04-18,,20,2019-12-19,7.5,CWE-22,NETWORK,LOW,HIGH
CVE-2018-8440,microsoft,Windows,Microsoft Windows Privilege Escalation Vulnerability,2022-03-28,An elevation of privilege vulnerability exists when Windows improperly handles calls to Advanced Local Procedure Call (ALPC).,Apply updates per vendor instructions.,2022-04-18,,20,2018-09-13,7.8,NVD-CWE-noinfo,LOCAL,LOW,HIGH
CVE-2018-8406,microsoft,DirectX Graphics Kernel (DXGKRNL),Microsoft DirectX Graphics Kernel Privilege Escalation Vulnerability,2022-03-28,An elevation of privilege vulnerability exists when the DirectX Graphics Kernel (DXGKRNL) driver improperly handles objects in memory.,Apply updates per vendor instructions.,2022-04-18,,20,2018-08-15,7.8,CWE-404,LOCAL,LOW,HIGH
CVE-2018-8405,microsoft,DirectX Graphics Kernel (DXGKRNL),Microsoft DirectX Graphics Kernel Privilege Escalation Vulnerability,2022-03-28,An elevation of privilege vulnerability exists when the DirectX Graphics Kernel (DXGKRNL) driver improperly handles objects in memory.,Apply updates per vendor instructions.,2022-04-18,,20,2018-08-15,7.8,CWE-404,LOCAL,LOW,HIGH
CVE-2017-0213,microsoft,Windows,Microsoft Windows Privilege Escalation Vulnerability,2022-03-28,Microsoft Windows COM Aggregate Marshaler allows for privilege escalation when an attacker runs a specially crafted application.,Apply updates per vendor instructions.,2022-04-18,,20,2017-05-12,4.7,NVD-CWE-noinfo,LOCAL,HIGH,MEDIUM
CVE-2017-0059,microsoft,Internet Explorer,Microsoft Internet Explorer Information Disclosure Vulnerability,2022-03-28,Microsoft Internet Explorer allow remote attackers to obtain sensitive information from process memory via a crafted web site.,Apply updates per vendor instructions.,2022-04-18,,20,2017-03-17,4.3,CWE-200,NETWORK,LOW,MEDIUM
CVE-2017-0037,microsoft,Edge and Internet Explorer,Microsoft Edge and Internet Explorer Type Confusion Vulnerability,2022-03-28,"Microsoft Edge and Internet Explorer have a type confusion vulnerability in mshtml.dll, which allows remote code execution.",Apply updates per vendor instructions.,2022-04-18,,20,2017-02-26,8.1,CWE-704,NETWORK,HIGH,HIGH
CVE-2016-7201,microsoft,Edge,Microsoft Edge Memory Corruption Vulnerability,2022-03-28,The Chakra JavaScript scripting engine in Microsoft Edge allows remote attackers to execute remote code or cause a denial of service (memory corruption) via a crafted web site.,Apply updates per vendor instructions.,2022-04-18,,20,2016-11-10,7.5,CWE-119,NETWORK,HIGH,HIGH
CVE-2016-7200,microsoft,Edge,Microsoft Edge Memory Corruption Vulnerability,2022-03-28,The Chakra JavaScript scripting engine in Microsoft Edge allows remote attackers to execute remote code or cause a denial of service (memory corruption) via a crafted web site.,Apply updates per vendor instructions.,2022-04-18,,20,2016-11-10,7.5,CWE-119,NETWORK,HIGH,HIGH
CVE-2016-0189,microsoft,Internet Explorer,Microsoft Internet Explorer Memory Corruption Vulnerability,2022-03-28,"The Microsoft JScript nd VBScript engines, as used in Internet Explorer and other products, allow attackers to execute remote code or cause a denial of service (memory corruption) via a crafted web site.",Apply updates per vendor instructions.,2022-04-18,,20,2016-05-11,7.5,CWE-119,NETWORK,HIGH,HIGH
